title,description,publishedAt,source,url,publishedAt_utc,publishedAt_ny,hour_bin
Best laptops: Our experts pick the top 12 models,"Finding the right laptop for your lifestyle means cutting through a lot of noise. Whether you’re looking for a high-performance gaming laptop a lightweight Chromebook for daily browsing, or a reliable Windows laptop for school, this guide is here to help.


…",2025-04-16T19:57:09Z,PCWorld,https://www.pcworld.com/article/436674/best-pc-laptops.html,2025-04-16 19:57:09+00:00,2025-04-16 15:57:09-04:00,2025-04-16 15:00:00-04:00
2023 Dodge Challenger SRT Demon 170 at No Reserve,"This 2023 Dodge Challenger SRT Demon 170 is #1,404 of approximately 3,300 examples built for the model year and is powered by a supercharged 6.2-liter Hemi High-Output V8 producing up to 1,025 horsepower and 945 lb-ft of torque, which is sent to the rear whee…",2025-04-16T19:56:58Z,Bringatrailer.com,https://bringatrailer.com/listing/2023-dodge-challenger-srt-demon-170-171/,2025-04-16 19:56:58+00:00,2025-04-16 15:56:58-04:00,2025-04-16 15:00:00-04:00
Apple to Enable a Lesser-Known iOS 16 Feature on iPhone Demo Units,"In its 2025 Environmental Progress Report released today, Apple revealed that it plans to expand its Clean Energy Charging feature to iPhone and iPad demo units on display at Apple Stores and other retail stores across the United States.





Introduced in th…",2025-04-16T19:56:13Z,MacRumors,https://www.macrumors.com/2025/04/16/demo-iphones-ipads-clean-energy-charging/,2025-04-16 19:56:13+00:00,2025-04-16 15:56:13-04:00,2025-04-16 15:00:00-04:00
"Twelve South’s 15W 3-in-1 HiRise 3 Deluxe MagSafe stand is one of the best, now back at $100 Amazon low (33% off)","Update: After going in and out of stock a couple times now, this particularly notable all-time low on one of the best 15W MagSafe stands is back again at Amazon. 



Amazon is now offering its best price to date on one of our favorite 3-in-1 15W MagSafe charg…",2025-04-16T19:54:12Z,9to5Toys,http://9to5toys.com/2025/04/16/twelve-souths-15w-3-in-1-hirise-3-deluxe/,2025-04-16 19:54:12+00:00,2025-04-16 15:54:12-04:00,2025-04-16 15:00:00-04:00
TRUMP EFFECT: NVIDIA Leads American-Made Chips Boom,"For the first time ever, chipmaking giant NVIDIA will manufacture its AI supercomputers entirely in the U.S., the company announced today — part of its pledge to produce $500 billion of AI infrastructure in the U.S. over the next four years.The company will b…",2025-04-16T19:53:16Z,Freerepublic.com,https://freerepublic.com/focus/f-news/4311427/posts,2025-04-16 19:53:16+00:00,2025-04-16 15:53:16-04:00,2025-04-16 15:00:00-04:00
Apple’s carbon footprint is shrinking,"Apple’s making steady progress toward its climate goals, the company’s latest environmental progress report shows. Its planet-heating pollution shrank by 800,000 metric tons last year compared to 2023, about a 5 percent drop. Looking back over the past decade…",2025-04-16T19:51:25Z,The Verge,https://www.theverge.com/news/650082/apple-environmental-progress-report-greenhouse-gas-emissions-climate-energy,2025-04-16 19:51:25+00:00,2025-04-16 15:51:25-04:00,2025-04-16 15:00:00-04:00
iOS 18.4.1 Update Released with CarPlay Fix & Security Patches,"Apple has released iOS 18.4.1 update for iPhone, along with iPadOS 18.4.1 for iPad. The software updates include a few bug fixes and important security patches, making them recommended to update. Additionally, iOS 18.4.1 includes a bug fix for a particular is…",2025-04-16T19:50:45Z,Osxdaily.com,https://osxdaily.com/2025/04/16/ios-18-4-1-update-released-with-carplay-fix-security-patches/,2025-04-16 19:50:45+00:00,2025-04-16 15:50:45-04:00,2025-04-16 15:00:00-04:00
Ridley Scott Signs With CAA Along With His Scott Free Film/TV Production Banner,"EXCLUSIVE: CAA has signed director Ridley Scott and Scott Free Productions, the film and television production vehicle formed by brothers Ridley and the late Tony Scott. A team of reps signed Scott, the four-time Academy Award-nominated director and producer …",2025-04-16T19:50:37Z,Deadline,http://deadline.com/2025/04/ridley-scott-signs-caa-scott-free-film-tv-production-banner-1236370271/,2025-04-16 19:50:37+00:00,2025-04-16 15:50:37-04:00,2025-04-16 15:00:00-04:00
Xbox's 'stream your owned games to console' feature now available to all via Game Pass Ultimate,"Following months of Xbox Insider testing, all Xbox Game Pass Ultimate subscribers can now stream a ""select"" number of their owned games to Xbox Series X/S or Xbox One consoles, without needing to install them first. It's one of several Xbox features launching…",2025-04-16T19:50:36Z,Eurogamer.net,https://www.eurogamer.net/xboxs-stream-your-owned-games-to-console-feature-now-available-via-game-pass-ultimate,2025-04-16 19:50:36+00:00,2025-04-16 15:50:36-04:00,2025-04-16 15:00:00-04:00
iOS 18.4.1 promises to fix frusturating CarPlay bugs,"Following the release of iOS 18.4 earlier this month, iPhone users reported several different connectivity problems with CarPlay. Now, Apple has released iOS 18.4.1, which includes a fix for at least one of the reported CarPlay problems…



 more…",2025-04-16T19:48:27Z,9to5Mac,https://9to5mac.com/2025/04/16/ios-18-4-1-promises-carplay-fix/,2025-04-16 19:48:27+00:00,2025-04-16 15:48:27-04:00,2025-04-16 15:00:00-04:00
Check Out Our 420 2025 Cannabis Gift Guide #420,"For 420 2025, Hip-Hop Wired is back with another cannabis and CBD gift guide roundup, covering edibles, drinks, and more.",2025-04-16T19:45:26Z,Hip-Hop Wired,https://hiphopwired.com/playlist/420-cannabis-gift-guide-2025/,2025-04-16 19:45:26+00:00,2025-04-16 15:45:26-04:00,2025-04-16 15:00:00-04:00
MacOS Sequoia 15.4.1 Update Released with Bug & Security Fixes,"Apple has released MacOS Sequoia 15.4.1 as a software update for Mac users running the Sequoia operating system. The update focuses exclusively on security updates and bug fixes, and contains no new features. Separately, Apple also released iOS 18.4.1 for iPh…",2025-04-16T19:38:01Z,Osxdaily.com,https://osxdaily.com/2025/04/16/macos-sequoia-15-4-1-update-released-with-security-fixes/,2025-04-16 19:38:01+00:00,2025-04-16 15:38:01-04:00,2025-04-16 15:00:00-04:00
Review: Ecovacs' X8 Pro Omni Robot Now Works With HomeKit,"With iOS 18.4, Apple added support for robot vacuums to HomeKit. There are a few Matter-enabled robot vacuums that can be added to the Home app for use with Siri, including the Deebot X8 Pro Omni from Ecovacs. I've been testing the X8 Pro Omni for the last se…",2025-04-16T19:36:41Z,MacRumors,https://www.macrumors.com/review/ecovacs-x8-pro-omni-matter/,2025-04-16 19:36:41+00:00,2025-04-16 15:36:41-04:00,2025-04-16 15:00:00-04:00
What to Know About 'Captain America: Brave New World' Coming to Disney Plus,"Viewers can now watch ""Captain America: Brave New World"" at home, but those wishing to stream the latest Marvel movie on Disney Plus will have to wait.",2025-04-16T19:34:13Z,Newsweek,https://www.newsweek.com/captain-america-brave-new-world-hits-disney-plus-2060106,2025-04-16 19:34:13+00:00,2025-04-16 15:34:13-04:00,2025-04-16 15:00:00-04:00
"Pluto's ""Whim Whamiee"" f/ YK Niece Is a Hit: What You Need to Know",The song recently made strong showings on key Apple Music and Spotify charts.,2025-04-16T19:30:01Z,Complex,https://www.complex.com/music/a/tracewilliamcowen/pluto-whim-whamiee-song,2025-04-16 19:30:01+00:00,2025-04-16 15:30:01-04:00,2025-04-16 15:00:00-04:00
Tim Cook Convinced President Trump To Exempt iPhones From China Tariffs,"According to a report, it was Tim Cook who convinced President Trump to exempt iPhones from China Tariffs. Here are all the details on this.
The post Tim Cook Convinced President Trump To Exempt iPhones From China Tariffs first appeared on Redmond Pie.",2025-04-18T19:57:27Z,redmondpie.com,https://www.redmondpie.com/tim-cook-convinced-president-trump-to-exempt-iphones-from-china-tariffs/,2025-04-18 19:57:27+00:00,2025-04-18 15:57:27-04:00,2025-04-18 15:00:00-04:00
Galia Lahav Spring 2026 Bridal Collection,"Galia Lahav presents “KISS & TELL,” a couture collection where mystery meets revelation. It redefines bridal seduction with corseted silhouettes, intricate guipure lace, and bold, statement-making details. Blending vintage romance with modern edge, each gown …",2025-04-18T19:55:58Z,tomandlorenzo.com,https://tomandlorenzo.com/2025/04/galia-lahav-spring-2026-bridal-collection/,2025-04-18 19:55:58+00:00,2025-04-18 15:55:58-04:00,2025-04-18 15:00:00-04:00
Less than one week left to save 70% on this rare Apple TV Plus deal,"If you've been waiting to subscribe to Apple TV Plus, now is a great time to sign up, thanks to this limited-time-only deal.",2025-04-18T19:50:06Z,Business Insider,https://www.businessinsider.com/guides/deals/apple-tv-plus-deal-2025-4b,2025-04-18 19:50:06+00:00,2025-04-18 15:50:06-04:00,2025-04-18 15:00:00-04:00
"Other Barks & Bites for Friday, April 18: CAFC Affirms Ineligibility of Machine Learning Claims; EPO’s Campinos Issues Opinion on Intervener Appeals; USPTO Ends Climate Change Mitigation Program",This week in Other Barks & Bites: the Federal Circuit affirms the invalidation of Recentive’s patent claims under Section 101 after finding them directed to generic applications of machine learning; the U.S. Chamber of Commerce’s International IP Index shows …,2025-04-18T19:46:46Z,IPWatchdog.com,https://ipwatchdog.com/2025/04/18/barks-congressional-epos-campinos-issues-opinion-intervener-appeals-uspto-ends-climate-change-mitigation-program/id=188313/,2025-04-18 19:46:46+00:00,2025-04-18 15:46:46-04:00,2025-04-18 15:00:00-04:00
Apple Sports: How to share poster-like game cards featuring the headline score,Learn how to share visual game cards via the Apple Sports app with your iMessage friends or publish these poster-like images on social media.,2025-04-18T19:45:56Z,Idownloadblog.com,https://www.idownloadblog.com/2025/04/18/share-game-cards-apple-sports-tutorial/,2025-04-18 19:45:56+00:00,2025-04-18 15:45:56-04:00,2025-04-18 15:00:00-04:00
My favorite Apple Watch for tracking my workouts is 32% off at major retailers,"I love the Apple Watch SE (2nd Gen) for its basic features and fair price, and it's 32% off at several major retailers now.",2025-04-18T19:44:55Z,ZDNet,https://www.zdnet.com/article/my-favorite-apple-watch-for-tracking-my-workouts-is-32-off-at-major-retailers/,2025-04-18 19:44:55+00:00,2025-04-18 15:44:55-04:00,2025-04-18 15:00:00-04:00
"Apple invents a multipurpose Spatial Tracking device for an XR Headset that could write, draw & control games using optical occlusion detection","Apple’s engineering teams appear to have been assigned the task of inventing a multipurpose handheld device for a future XR Headset users could use to write, draw and control video games with. Apple’s latest patent application expands on this pencil-like tool…",2025-04-18T19:44:35Z,Patently Apple,https://www.patentlyapple.com/2025/04/apple-invents-a-multipurpose-spatial-tracking-device-for-an-xr-headset-that-could-write-draw-control-games-using-optical-o.html,2025-04-18 19:44:35+00:00,2025-04-18 15:44:35-04:00,2025-04-18 15:00:00-04:00
"Podcast Rewind: A Spicy Browser Extension, iPad Feels, a Fancy 4K OLED Display, Marathoning in the Mountains, and Government Cheese","Enjoy the latest episodes from MacStories’ family of podcasts: Comfort Zone https://youtu.be/zsDEiv8bjMo Niléane brings a spicy browser extension, Chris works through some iPad feelings, and Matt made the gang decide what app they consider “undefeated”. MacSt…",2025-04-18T19:40:15Z,MacStories,https://www.macstories.net/news/podcast-rewind-a-spicy-browser-extension-ipad-feels-a-fancy-4k-oled-display-marathoning-in-the-mountains-and-government-cheese/,2025-04-18 19:40:15+00:00,2025-04-18 15:40:15-04:00,2025-04-18 15:00:00-04:00
15 Historical LGBTQ+ TV Shows To Remind You That We Have Always Been Here,"From Our Flag Means Death to A League of Their Own to It's a Sin, here are 15 LGBTQ+ shows set in the past with vibrant, interesting queer characters.
The post 15 Historical LGBTQ+ TV Shows To Remind You That We Have Always Been Here appeared first on Autostr…",2025-04-18T19:35:00Z,Autostraddle.com,http://www.autostraddle.com/historical-lgbtq-tv-shows-to-remind-you-that-we-have-always-been-here/,2025-04-18 19:35:00+00:00,2025-04-18 15:35:00-04:00,2025-04-18 15:00:00-04:00
Our Phones Are Making Us Miserable — So Why Can’t We Let Go?,"They’re sapping our energy, our sense of community, our very attention spans. In an age of digital overload, opting out is radical — and appealing.",2025-04-18T19:33:28Z,phillymag.com,https://www.phillymag.com/news/2025/04/18/smartphones-digital-overload-detox/,2025-04-18 19:33:28+00:00,2025-04-18 15:33:28-04:00,2025-04-18 15:00:00-04:00
Justin Rose Reacts to Wife Kate Being Dubbed 'Mystery Woman' After Hugging Rory McIlroy During Masters Final,"Pro golfer Justin Rose reacted to his wife, Kate, being dubbed the 'mystery woman' who was seen hugging Rory McIlroy after his 2025 Masters win while speaking to reporters.",2025-04-18T19:32:40Z,PEOPLE,https://people.com/justin-rose-reacts-to-wife-dubbed-mystery-woman-after-hugging-rory-mcilroy-11718123,2025-04-18 19:32:40+00:00,2025-04-18 15:32:40-04:00,2025-04-18 15:00:00-04:00
LinkedIn has fun games on it and I’m not making that up,"Hear me out: LinkedIn actually has fun games on it. I’m not joking. There are games buried underneath all the posts from CEOs disrupting industries through the power of AI, and they’re actually kind of good. My favorite is Zip, a game about filling up a grid …",2025-04-18T19:32:17Z,Polygon,https://www.polygon.com/gaming/561445/linkedin-has-fun-games-zip-pinpoint,2025-04-18 19:32:17+00:00,2025-04-18 15:32:17-04:00,2025-04-18 15:00:00-04:00
mlx-lm 0.23.0,LLMs on Apple silicon with MLX and the Hugging Face Hub,2025-04-18T19:30:10Z,Pypi.org,https://pypi.org/project/mlx-lm/0.23.0/,2025-04-18 19:30:10+00:00,2025-04-18 15:30:10-04:00,2025-04-18 15:00:00-04:00
Trump won’t fire Powell — but he could still pressure the Fed. Here's how,,2025-04-18T19:27:20Z,Biztoc.com,https://biztoc.com/x/e896d10e8b39db45,2025-04-18 19:27:20+00:00,2025-04-18 15:27:20-04:00,2025-04-18 15:00:00-04:00
"Wall Street Trims Ratings for Novo Nordisk Stock, as Ozempic’s Competition Grows",,2025-04-18T19:26:56Z,Biztoc.com,https://biztoc.com/x/1ae61ca2bf2543bb,2025-04-18 19:26:56+00:00,2025-04-18 15:26:56-04:00,2025-04-18 15:00:00-04:00
How do you like them apples? Apple genus evolution revealed,"A new comparison and analysis of the genomes of species in the genus Malus, which includes the domesticated apple and its wild relatives, revealed the evolutionary relationships among the species and how their genomes have evolved over the past nearly 60 mill…",2025-04-22T19:58:24Z,Science Daily,https://www.sciencedaily.com/releases/2025/04/250422155824.htm,2025-04-22 19:58:24+00:00,2025-04-22 15:58:24-04:00,2025-04-22 15:00:00-04:00
Indo Sport podcast: Marc Canham steps down – what it means for Irish football and what comes next?,Will Slattery is joined by Aidan Fitzmaurice to discuss the shock departure of Marc Canham as the FAI's Chief Football officer.,2025-04-22T19:57:07Z,Independent.ie,https://www.independent.ie/podcasts/indo-sport-podcast/indo-sport-podcast-marc-canham-steps-down-what-it-means-for-irish-football-and-what-comes-next/a1270457254.html,2025-04-22 19:57:07+00:00,2025-04-22 15:57:07-04:00,2025-04-22 15:00:00-04:00
Spring Cleaning for Earth Day: Where to Recycle Computers and Printers for Free,"You may even get store credit in some cases when you trade in your PCs, laptops and printers.",2025-04-22T19:56:38Z,CNET,https://www.cnet.com/tech/computing/spring-cleaning-for-earth-day-where-to-recycle-computers-and-printers-for-free/,2025-04-22 19:56:38+00:00,2025-04-22 15:56:38-04:00,2025-04-22 15:00:00-04:00
Best Buy Outlet Event Wearable Technology Deals: Up to 70% off + free shipping,"Save on a wide selection of smartwatches, rings, and accessories from Apple, Samsung, Google, and more. There are new, refurbished, and open-box items withing this sale. My Best Buy members get free shipping. (It's free to join. Shipping is free for everyone …",2025-04-22T19:55:45Z,Dealnews.com,https://www.dealnews.com/Best-Buy-Outlet-Event-Wearable-Technology-Deals-Up-to-70-off-free-shipping/21732622.html,2025-04-22 19:55:45+00:00,2025-04-22 15:55:45-04:00,2025-04-22 15:00:00-04:00
Google Fi virtual mobile service gets new unlimited plan celebrating 10 years,Google is celebrating the 10th anniversary of Google Fi Wireless by launching a new unlimited plan and other features. Read more...,2025-04-22T19:52:01Z,Neowin,https://www.neowin.net/news/google-fi-virtual-mobile-service-gets-new-unlimited-plan-celebrating-10-years/,2025-04-22 19:52:01+00:00,2025-04-22 15:52:01-04:00,2025-04-22 15:00:00-04:00
1 in 2 Surveyed Willing to Pay at Least $10/Month for Apple Intelligence,"A little more than half of respondents in a recent survey said they would be willing to pay at least $10 per month for unlimited access to Apple Intelligence.





In an online survey conducted in February and March, investment firm Morgan Stanley asked thous…",2025-04-22T19:46:27Z,MacRumors,https://www.macrumors.com/2025/04/22/apple-intelligence-payment-survey/,2025-04-22 19:46:27+00:00,2025-04-22 15:46:27-04:00,2025-04-22 15:00:00-04:00
Report: Apple Vision Pro Managers Taking Lead of Siri Revamp,"Apple’s work on Siri will reportedly be led by managers who developed Vision Pro. Vision Pro creator Mike Rockwell, who is the new Siri engineering chief, is bringing members of the Vision Pro management team to Siri, replacing or demoting previous managers o…",2025-04-22T19:46:17Z,pymnts.com,https://www.pymnts.com/apple/2025/report-apple-vision-pro-managers-taking-lead-of-siri-revamp/,2025-04-22 19:46:17+00:00,2025-04-22 15:46:17-04:00,2025-04-22 15:00:00-04:00
Noah Jupe To Star In Jaume Collet-Serra’s Thriller ‘Play Dead’,"EXCLUSIVE: Rising British actor Noah Jupe (A Quiet Place) is set to star in Play Dead, the new survival thriller from Carry-On‘s Jaume Collet-Serra that we told you about back in February, sources tell Deadline. No details have yet emerged about Jupe’s charac…",2025-04-22T19:46:00Z,Deadline,http://deadline.com/2025/04/noah-jupe-to-star-play-dead-jaume-collet-serra-1236370984/,2025-04-22 19:46:00+00:00,2025-04-22 15:46:00-04:00,2025-04-22 15:00:00-04:00
Elegy for the Video Screenshot,"Nora Deligter: It was around this time when streaming platforms like Netflix, HBO Max, Amazon Prime, and the Criterion Channel imposed a quiet embargo on the screenshot. At first, there were workarounds: users could continue to screenshot by using the browser…",2025-04-22T19:38:04Z,Mjtsai.com,https://mjtsai.com/blog/2025/04/22/elegy-for-the-video-screenshot/,2025-04-22 19:38:04+00:00,2025-04-22 15:38:04-04:00,2025-04-22 15:00:00-04:00
DeskMat 1.0,"Matthias Gansrigler: I have a new app out that lets you sweep things under the rug – virtually: DeskMat for Mac.With DeskMat, you cover the mess of files and folders on your Desktop with a single click – and show them again in just the same way.It makes for c…",2025-04-22T19:37:49Z,Mjtsai.com,https://mjtsai.com/blog/2025/04/22/deskmat-1-0/,2025-04-22 19:37:49+00:00,2025-04-22 15:37:49-04:00,2025-04-22 15:00:00-04:00
Framous 1.0 and Shareshot,"Jason Snell: Some people, whether you’re in the media or software development or technical support, take and publish a lot of device screenshots. And while an image straight from an iPhone or Apple Watch looks fine, it often looks much better to be put in con…",2025-04-22T19:37:47Z,Mjtsai.com,https://mjtsai.com/blog/2025/04/22/framous-1-0-and-shareshot/,2025-04-22 19:37:47+00:00,2025-04-22 15:37:47-04:00,2025-04-22 15:00:00-04:00
Legacy Brands Thrive On Constant Renewal,"What is it about successful brands that attracts change over time when added size, complexity, and maturity advance to depress the culture of innovation that set the world on fire in the beginning? How can legacy brands ensure the magic that existed at incept…",2025-04-22T19:37:07Z,Brandingstrategyinsider.com,https://brandingstrategyinsider.com/legacy-brands-thrive-on-constant-renewal/,2025-04-22 19:37:07+00:00,2025-04-22 15:37:07-04:00,2025-04-22 15:00:00-04:00
Why Google's search engine trial is about AI,What started off as an antitrust trial about Google's dominance in the search engine market has led to a penalties phase that is focused on its role in artificial intelligence.,2025-04-29T19:59:53Z,NPR,https://www.npr.org/2025/04/29/nx-s1-5377353/google-antitrust-remedies-trial-ai,2025-04-29 19:59:53+00:00,2025-04-29 15:59:53-04:00,2025-04-29 15:00:00-04:00
"Labor Day Sale: How To Get Legitimate Office Suite For Just $17, Microsoft Windows Lifetime License For $8, More","With Labor Day now just around the corner, you're likely to see plenty of discounts offered across all kinds of things. From software to home appliances, there is money to be saved. But if you're in the market for new Microsoft software, there's only one plac…",2025-04-29T19:59:07Z,redmondpie.com,https://www.redmondpie.com/labor-day-sale-how-to-get-legitimate-office-suite-for-just-17-microsoft-windows-lifetime-license-for-8-more/,2025-04-29 19:59:07+00:00,2025-04-29 15:59:07-04:00,2025-04-29 15:00:00-04:00
Apple Gave Your iPhone a Useful New Feature You Probably Didn’t Know About,,2025-04-29T19:56:26Z,Yahoo Entertainment,https://consent.yahoo.com/v2/collectConsent?sessionId=1_cc-session_48117636-395a-499d-97d6-37b2a483690d,2025-04-29 19:56:26+00:00,2025-04-29 15:56:26-04:00,2025-04-29 15:00:00-04:00
‘Desperate Housewives’ Offshoot ‘Wisteria Lane’ In Works At Onyx From Kerry Washington & Natalie Chaidez,"EXCLUSIVE: One of the most famous streets in TV history is ready to welcome new residents. Wisteria Lane, a reimagining of the hit ABC mystery dramedy series Desperate Housewives, has been set up for development at Onyx Collective, Deadline has learned. It co…",2025-04-29T19:55:00Z,Deadline,http://deadline.com/2025/04/desperate-housewives-reboot-wisteria-lane-kerry-washington-1236379573/,2025-04-29 19:55:00+00:00,2025-04-29 15:55:00-04:00,2025-04-29 15:00:00-04:00
Whatever Happened to the Cast of 'Silicon Valley'?,"Silicon Valley ended just six years ago, and despite its popularity at the time, the series hasn't really maintained much of a presence. It rarely comes up in nostalgic retrospectives, and few of its cast members have broken through in...
Read more...",2025-04-29T19:50:11Z,Pajiba.com,https://www.pajiba.com/tv_reviews/whatever-happened-to-the-cast-of-silicon-valley.php,2025-04-29 19:50:11+00:00,2025-04-29 15:50:11-04:00,2025-04-29 15:00:00-04:00
"Arms race: Apple's waiting for robotics for US iPhone assembly, says Commerce Secretary","Apple will eventually make the iPhone in the United States, as soon as it has the ""robotic arms"" to do so, CEO Tim Cook allegedly told U.S. Commerce Secretary Howard Lutnick.A robot arm used to recycle iPhones, not manufacture them - Image Credit: AppleThe Tr…",2025-04-29T19:48:09Z,AppleInsider,https://appleinsider.com/articles/25/04/29/arms-race-apples-waiting-for-robotics-for-us-iphone-assembly-says-commerce-secretary,2025-04-29 19:48:09+00:00,2025-04-29 15:48:09-04:00,2025-04-29 15:00:00-04:00
Score $80 Off AirPods Pro 2 at Best Buy and Enjoy Free Apple Music,"Looking to get a pair of AirPods Pro 2 at a great deal while enjoying some free Apple Music? Fortunately for you, I find deals like a bloodhound looking for a convict. A certain big-box retailer has a deal that's too sweet for audio nerds to pass up. Continue…",2025-04-29T19:47:29Z,The Mac Observer,https://www.macobserver.com/deals/score-80-off-airpods-pro-2-at-best-buy-and-enjoy-free-apple-music/,2025-04-29 19:47:29+00:00,2025-04-29 15:47:29-04:00,2025-04-29 15:00:00-04:00
"‘Adolescence,’ ‘The Pitt’ & ‘Dying For Sex’ Top 2025 Gotham Television Awards Nominations","The nominees for the second annual Gotham Television Awards have been revealed, and to no one’s surprise, Netflix’s “Adolescence” was at the top of the list. The critical and streaming hit landed four nominations, including Breakthrough Limited Series and act…",2025-04-29T19:45:38Z,Theplaylist.net,https://theplaylist.net/adolescence-the-pitt-dying-for-sex-top-2025-gotham-television-awards-nominations-20250429/,2025-04-29 19:45:38+00:00,2025-04-29 15:45:38-04:00,2025-04-29 15:00:00-04:00
