title,description,publishedAt,source,url,publishedAt_utc,publishedAt_ny,hour_bin
Magnificent 7 stocks slide amid Trump tariff worries,The market’s highest-performing tech stocks all slid on Monday morning amid worries over President Donald Trump’s tariffs.Read more...,2025-03-31T14:23:00Z,Quartz India,https://qz.com/magnificent-7-stocks-slide-trump-tariffs-tesla-nvidia-1851773474,2025-03-31 14:23:00+00:00,2025-03-31 10:23:00-04:00,2025-03-31 10:00:00-04:00
Nervous about stock picking? Here's why ASX ETFs are a smart and simple way to invest,"This is the easy way to invest your money into the share market.
The post Nervous about stock picking? Here's why ASX ETFs are a smart and simple way to invest appeared first on The Motley Fool Australia.",2025-03-31T14:19:55Z,Motley Fool Australia,https://www.fool.com.au/2025/04/01/nervous-about-stock-picking-heres-why-asx-etfs-are-a-smart-and-simple-way-to-invest/,2025-03-31 14:19:55+00:00,2025-03-31 10:19:55-04:00,2025-03-31 10:00:00-04:00
"Analyst Who’s Looking for Market Rally Suggests Bullish AMZN, GOOG Option Strategies","In This Article:
The market will eventually start rallying again, Joe Tigay, the Principal of Equity Armor Investments recently told The Schwab Network. Tigay suggested two bullish option trades involving Amazon (AMZN) and Alphabet (GOOG,GOOGL).
Tigay Is a Bi…",2025-03-31T15:04:36Z,Biztoc.com,https://biztoc.com/x/a0c88733305fb20d,2025-03-31 15:04:36+00:00,2025-03-31 11:04:36-04:00,2025-03-31 11:00:00-04:00
"Don't worry about Jeff Bezos’ lavish wedding, Venice mayor tells concerned locals","The mayor of Venice confirmed that Jeff Bezos and Lauren Sánchez would hold their upcoming wedding in the iconic Italian city — while also pushing back on speculation that the nuptials would substantially disrupt daily life for locals, many of whom have grown…",2025-03-31T15:00:00Z,Quartz India,https://qz.com/jeff-bezos-wedding-venice-mayor-concerns-yacht-1851773507,2025-03-31 15:00:00+00:00,2025-03-31 11:00:00-04:00,2025-03-31 11:00:00-04:00
"Two Veteran Investors Tout AMZN, MSFT",Two longtime investors recently told CNBC that Amazon (AMZN) and Microsoft (MSFT) represent good buys at their current levels. The Weakness of AMZN and MSFT ...,2025-03-31T16:51:35Z,Yahoo Entertainment,https://finance.yahoo.com/news/two-veteran-investors-tout-amzn-165135626.html,2025-03-31 16:51:35+00:00,2025-03-31 12:51:35-04:00,2025-03-31 12:00:00-04:00
Amazon wants its new AI agent to do stuff on the web for you,Amazon (AMZN) introduced a new artificial intelligence model on Monday that can do basic things on a user’s behalf inside a web browser.Read more...,2025-03-31T18:02:00Z,Quartz India,https://qz.com/amazon-ai-agent-nova-act-perform-tasks-aws-1851773549,2025-03-31 18:02:00+00:00,2025-03-31 14:02:00-04:00,2025-03-31 14:00:00-04:00
Nvidia To Invest Billions In U.S. Supply Chain As Tech Companies Commit To Trump's Onshoring Pledge,,2025-03-31T19:00:19Z,Benzinga,https://www.benzinga.com/25/03/44567096/nvidia-to-invest-billions-in-u-s-supply-chain-as-tech-companies-commit-to-trumps-onshoring-pledge,2025-03-31 19:00:19+00:00,2025-03-31 15:00:19-04:00,2025-03-31 15:00:00-04:00
Amazon resumes Prime Air drone deliveries in test markets following software updates,Amazon is restarting drone deliveries in its two test markets after a two-month pause to update software.Read more...,2025-04-01T14:04:00Z,Quartz India,https://qz.com/amazon-resumes-prime-air-drone-deliveries-arizona-texas-1851773976,2025-04-01 14:04:00+00:00,2025-04-01 10:04:00-04:00,2025-04-01 10:00:00-04:00
Jeff Bezos is getting married in Venice. How will it compare with these 5 other extravagant nuptials?,"While details about the Amazon founder’s big day are under wraps, Lauren Sánchez's brother says the wedding will rival Princess Diana’s “wedding of the century”",2025-04-01T15:37:00Z,Quartz India,https://qz.com/jeff-bezos-wedding-most-extravagant-nuptials-1851773991,2025-04-01 15:37:00+00:00,2025-04-01 11:37:00-04:00,2025-04-01 11:00:00-04:00
"Stock Is “Starting to Look Appealing,” Consumer Expert Says","In This Article:
After Amazon (AMZN) stock pulled back sharply in recent months, the shares ""are starting to look appealing,"" and they are providing investors with a good ""buying opportunity"", Megan Brantley, VP of Research at LikeFolio recently told Schwab N…",2025-04-02T16:55:04Z,Biztoc.com,https://biztoc.com/x/55491761188d9125,2025-04-02 16:55:04+00:00,2025-04-02 12:55:04-04:00,2025-04-02 12:00:00-04:00
Amazon reportedly bids to buy TikTok as deadline looms,"Amazon.com AMZN-Q has put in a last-minute offer to buy all of short-form video app TikTok, the New York Times reported on Wednesday, citing three people familiar with the bid.
U.S. President Donald Trump will consider on Wednesday a final proposal related to…",2025-04-02T16:43:33Z,Biztoc.com,https://biztoc.com/x/0a640c16af52390c,2025-04-02 16:43:33+00:00,2025-04-02 12:43:33-04:00,2025-04-02 12:00:00-04:00
"Amazon (AMZN) Stock Is “Starting to Look Appealing,” Consumer Expert Says",,2025-04-02T16:29:05Z,Yahoo Entertainment,https://consent.yahoo.com/v2/collectConsent?sessionId=1_cc-session_4c754de0-a624-4dbb-9009-08152f5c559d,2025-04-02 16:29:05+00:00,2025-04-02 12:29:05-04:00,2025-04-02 12:00:00-04:00
Amazon wants to buy TikTok as Trump's deadline looms,"Amazon (AMZN) is making an under-the-wire bid to acquire popular social media app TikTok, the New York Times reported on Wednesday, citing three people familiar with the matter.Read more...",2025-04-02T17:11:00Z,Quartz India,https://qz.com/amazon-tiktok-bytedance-china-deadline-trump-1851774326,2025-04-02 17:11:00+00:00,2025-04-02 13:11:00-04:00,2025-04-02 13:00:00-04:00
Experts Clash on Amazon’s (AMZN) Outlook,"Two guests on Schwab Network had very different views of Amazon (AMZN) stock today. “Alarm bells” are ringing for AMZN, said Ron Westfall, Research Director ...",2025-04-02T18:08:38Z,Yahoo Entertainment,https://finance.yahoo.com/news/experts-clash-amazon-amzn-outlook-180838346.html,2025-04-02 18:08:38+00:00,2025-04-02 14:08:38-04:00,2025-04-02 14:00:00-04:00
Ray jobs on Amazon SageMaker HyperPod: scalable and resilient distributed AI,"Ray is an open source framework that makes it straightforward to create, deploy, and optimize distributed Python jobs. In this post, we demonstrate the steps involved in running Ray jobs on SageMaker HyperPod.",2025-04-02T19:18:48Z,Amazon.com,https://aws.amazon.com/blogs/machine-learning/ray-jobs-on-amazon-sagemaker-hyperpod-scalable-and-resilient-distributed-ai/,2025-04-02 19:18:48+00:00,2025-04-02 15:18:48-04:00,2025-04-02 15:00:00-04:00
Hbar Foundation Teams Up With OnlyFans Founder for TikTok Bid: Reuters,HBAR is up 1.5% in the last 24 hours.,2025-04-02T19:10:00Z,CoinDesk,https://www.coindesk.com/markets/2025/04/02/hbar-foundation-teams-up-with-onlyfans-founder-for-tiktok-bid,2025-04-02 19:10:00+00:00,2025-04-02 15:10:00-04:00,2025-04-02 15:00:00-04:00
Amazon targets April 9 launch of first Kuiper internet satellites,"Amazon.com AMZN-Q said on Wednesday it plans to launch the first 27 satellites for its Project Kuiper internet network next week, pinning down a long-awaited start to the company’s plan to deploy a massive constellation that will rival Elon Musk’s Starlink sy…",2025-04-02T19:07:05Z,Biztoc.com,https://biztoc.com/x/6f179ca5a9449e40,2025-04-02 19:07:05+00:00,2025-04-02 15:07:05-04:00,2025-04-02 15:00:00-04:00
Apple leads Magnificent 7 stock drop amid Trump tariffs,"Apple (AAPL) shares were down by 8.4% at the market open on Thursday, leading the decline of Magnificent 7 stocks after President Donald Trump announced “reciprocal tariffs” following the market close on Wednesday.Read more...",2025-04-03T14:35:00Z,Quartz India,https://qz.com/apple-magnificent-7-stocks-fall-trump-reciprocal-tariff-1851774496,2025-04-03 14:35:00+00:00,2025-04-03 10:35:00-04:00,2025-04-03 10:00:00-04:00
"Apple sheds $300 billion in tariff-fueled sell-off, on track for worst drop since March 2020",The tariff-fueled sell-off has erased $800 billion from Magnificent Seven stocks.,2025-04-03T17:57:27Z,Yahoo Entertainment,https://finance.yahoo.com/news/apple-sheds-300-billion-in-tariff-fueled-sell-off-on-track-for-worst-drop-since-march-2020-175727479.html,2025-04-03 17:57:27+00:00,2025-04-03 13:57:27-04:00,2025-04-03 13:00:00-04:00
Citi Reportedly Tells Investors to Buy AMZN Stock on Weakness,"In This Article:
After Amazon (AMZN) initiated a takeover bid for TikTok in the U.S., Citi recommended that investors buy AMZN on weakness, Schwab Network reported today.
Citi believes that AMZN would benefit significantly from acquiring TikTok.
Photo by Aust…",2025-04-03T17:18:16Z,Biztoc.com,https://biztoc.com/x/fc265f1d3a489206,2025-04-03 17:18:16+00:00,2025-04-03 13:18:16-04:00,2025-04-03 13:00:00-04:00
Three ways Big Tech is vulnerable to EU tariff retaliation,"President Donald Trump announced widespread tariffs on Wednesday, sending the stock market plunging. One of the more significant of these tariffs is a 20% levy on goods coming from longtime U.S. ally and trade partner the European Union.Read more...",2025-04-03T18:53:00Z,Quartz India,https://qz.com/how-big-tech-vulnerable-eu-tariff-retaliation-trump-1851774561,2025-04-03 18:53:00+00:00,2025-04-03 14:53:00-04:00,2025-04-03 14:00:00-04:00
"The Magnificent 7 stocks slide again and the Dow drops 1,100 points as China retaliates in trade war","The Magnificent 7 stocks all dropped as the S&P 500, the Nasdaq Composite, and the Dow Jones Industrial Average opened lower after China retaliated against new U.S. tariffs. Shares narrowed pre-market declines after March employment numbers came in better tha…",2025-04-04T14:15:00Z,Quartz India,https://qz.com/mag7-stocks-fall-trade-war-tesla-nvidia-jobs-1851774739,2025-04-04 14:15:00+00:00,2025-04-04 10:15:00-04:00,2025-04-04 10:00:00-04:00
Warren Buffet's market wisdom when stocks fall is all in this 19th century poem,"This week, President Donald Trump’s new tariffs sent shockwaves through the stock market, triggering a sharp sell-off as investors reacted to escalating trade tensions between the U.S. and China. Read more...",2025-04-04T16:35:00Z,Quartz India,https://qz.com/warren-buffet-berkshire-hathaway-trump-tariffs-dow-tech-1851774798,2025-04-04 16:35:00+00:00,2025-04-04 12:35:00-04:00,2025-04-04 12:00:00-04:00
"Retail Investors Pour $4,700,000,000 Into Stock Market in One Day Amid Market Meltdown: JPMorgan Chase","Retail investors are trying to time the market and take advantage of the multi trillion-dollar market meltdown triggered by Trump’s new tariffs. A new note to clients from JPMorgan Chase says mainstreet investors poured $4.7 billion into stocks on Thursday, r…",2025-04-04T17:53:31Z,The Daily Hodl,https://dailyhodl.com/2025/04/04/retail-investors-pour-4700000000-into-stock-market-in-one-day-amid-market-meltdown-jpmorgan-chase/,2025-04-04 17:53:31+00:00,2025-04-04 13:53:31-04:00,2025-04-04 13:00:00-04:00
"Amazon (AMZN) May Face $10B Tariff Hit, But AI Strategy and Vendor Flexibility Offer Cushion",,2025-04-07T18:22:58Z,Yahoo Entertainment,https://consent.yahoo.com/v2/collectConsent?sessionId=1_cc-session_01892154-7d05-4279-b4ac-bbcb7cf174bc,2025-04-07 18:22:58+00:00,2025-04-07 14:22:58-04:00,2025-04-07 14:00:00-04:00
Look inside Mark Zuckerberg's $23 million D.C. mansion,The Meta CEO's new digs are a 12-minute drive away from the White House and right across from the vice presidential compound,2025-04-07T19:11:00Z,Quartz India,https://qz.com/mark-zuckerberg-dc-real-estate-donald-trump-1851775080,2025-04-07 19:11:00+00:00,2025-04-07 15:11:00-04:00,2025-04-07 15:00:00-04:00
"Investor Says AMZN, TSLA Have “Incredibly Bright” Futures","In This Article:
The futures of Amazon (AMZN) and Tesla (TSLA) are ""incredibly bright,"" Dan Crowley, the Portfolio Manager of Nightview Capital told Schwab Network recently.
Crowley also believes that ""opportunities are developing"" for investors to buy top-no…",2025-04-08T14:26:55Z,Biztoc.com,https://biztoc.com/x/b2b3eb7db25738a2,2025-04-08 14:26:55+00:00,2025-04-08 10:26:55-04:00,2025-04-08 10:00:00-04:00
"Tesla, Microsoft, and Meta follow Nvidia in Magnificent 7 stock rally","The trade-war selloff took a breather on Tuesday, buoying Big Tech firms including Nvidia (NVDA), Tesla (TSLA), Meta (META), and Microsoft (MSFT), after a mixed day on Monday and two especially gnarly days last week wiped $1.8 trillion off the market value of…",2025-04-08T15:59:00Z,Quartz India,https://qz.com/tesla-microsoft-meta-nvidia-big-tech-rally-tariffs-1851775247,2025-04-08 15:59:00+00:00,2025-04-08 11:59:00-04:00,2025-04-08 11:00:00-04:00
Is Nvidia Stock Too Cheap?,Why would an investor pay 30 times earnings for Amazon stock (NASDAQ: AMZN) when Nvidia stock is trading at 33 times earnings?,2025-04-08T15:48:39Z,Forbes,https://www.forbes.com/sites/greatspeculations/2025/04/08/is-nvidia-stock-too-cheap/,2025-04-08 15:48:39+00:00,2025-04-08 11:48:39-04:00,2025-04-08 11:00:00-04:00
"Well-Known Investor Buys More AMZN, UBER, Starts Position in RKT","Prominent investor Josh Brown, the co-founder of Ritholtz Wealth Management, recently told CNBC why he decided to add to his positions in Amazon (AMZN) and...",2025-04-08T15:48:11Z,Yahoo Entertainment,https://finance.yahoo.com/news/well-known-investor-buys-more-154811273.html,2025-04-08 15:48:11+00:00,2025-04-08 11:48:11-04:00,2025-04-08 11:00:00-04:00
"U.S. stock market today: Market rallies - Dow jumps 1,400 pts, Nasdaq up 3.6%, S&P 500 gains 3.4%; Apple, Tesla, Nvidia lead tech rally on easing trade fears and bullish sentiment — Is this the start of a sustained market comeback?","U.S. stock market today saw a massive rebound, with the Dow Jones surging 1,400 points, the Nasdaq up 3.6%, and the S&P 500 gaining 3.4%. Major tech stocks like Apple, Tesla, and Nvidia led the charge, climbing over 4–5% each. This jump came as investors grew…",2025-04-08T15:11:31Z,The Times of India,https://economictimes.indiatimes.com/news/international/us/u-s-stock-market-today-market-rallies-dow-jumps-1400-pts-nasdaq-up-3-6-sp-500-gains-3-4-apple-tesla-nvidia-lead-tech-rally-on-easing-trade-fears-and-bullish-sentiment-is-this-the-start-of-a-sustained-market-comeback/articleshow/120099502.cms,2025-04-08 15:11:31+00:00,2025-04-08 11:11:31-04:00,2025-04-08 11:00:00-04:00
Manage concurrent write conflicts in Apache Iceberg on the AWS Glue Data Catalog,"This post demonstrates how to implement reliable concurrent write handling mechanisms in Iceberg tables. We will explore Iceberg’s concurrency model, examine common conflict scenarios, and provide practical implementation patterns of both automatic retry mech…",2025-04-08T16:51:54Z,Amazon.com,https://aws.amazon.com/blogs/big-data/manage-concurrent-write-conflicts-in-apache-iceberg-on-the-aws-glue-data-catalog/,2025-04-08 16:51:54+00:00,2025-04-08 12:51:54-04:00,2025-04-08 12:00:00-04:00
"JPMorgan Cuts Its Price Targets on Many Internet Names, Including META and AMZN","In This Article:
JPMorgan slashed its price targets on 25 companies in the internet space, citing macroeconomic issues, Schwab Network recently reported.
Among the most prominent names whose price targets were slashed by the bank are Meta (META), Amazon (AMZN…",2025-04-08T16:39:48Z,Biztoc.com,https://biztoc.com/x/0b4705f97dab5811,2025-04-08 16:39:48+00:00,2025-04-08 12:39:48-04:00,2025-04-08 12:00:00-04:00
"Is Amazon.com, Inc. (AMZN) the Best Big Data Stock to Buy According to Analysts?","We recently published a list of 13 Best Big Data Stocks to Buy According to Analysts. In this article, we are going to take a look at where Amazon.com, Inc. ...",2025-04-08T18:05:52Z,Yahoo Entertainment,https://finance.yahoo.com/news/amazon-com-inc-amzn-best-180552690.html,2025-04-08 18:05:52+00:00,2025-04-08 14:05:52-04:00,2025-04-08 14:00:00-04:00
1 Growth Stock Down 20% to Buy Right Now,"In This Article:
The market is suffering under the weight of President Donald Trump's tariffs on trading partners, as investors try to understand how they'll affect companies.
One growth stock that's fallen hard this year is Amazon (NASDAQ: AMZN), which is do…",2025-04-09T14:33:44Z,Biztoc.com,https://biztoc.com/x/5c558297a272a3c3,2025-04-09 14:33:44+00:00,2025-04-09 10:33:44-04:00,2025-04-09 10:00:00-04:00
Amazon’s Starlink Challenger Is Finally Heading to Orbit,,2025-04-09T14:10:47Z,Biztoc.com,https://biztoc.com/x/44c2200bc4cf90da,2025-04-09 14:10:47+00:00,2025-04-09 10:10:47-04:00,2025-04-09 10:00:00-04:00
Amazon cancels some orders from China amid U.S.-China tariff war,"Amazon has canceled some orders from vendors in China, Vietnam and Thailand as President Trump's tariff policy sent its stock tumbling.",2025-04-09T15:32:35Z,TheStreet,https://www.thestreet.com/crypto/markets/amazon-cancels-some-orders-from-china-as-the-u-s-china-tariff-war,2025-04-09 15:32:35+00:00,2025-04-09 11:32:35-04:00,2025-04-09 11:00:00-04:00
Two Banks Lower Their Price Targets on Amazon (AMZN) Stock,"In This Article:
Two major banks recently slashed their price targets on Amazon (AMZN) stock, but both banks remain bullish on the tech giant's overall outlook, Schwab Network reported.
Mizuho's Take on AMZN Stock
The Japanese bank lowered its price target on…",2025-04-09T16:03:40Z,Biztoc.com,https://biztoc.com/x/3b63702c72b0b901,2025-04-09 16:03:40+00:00,2025-04-09 12:03:40-04:00,2025-04-09 12:00:00-04:00
Amazon already appears to be cutting back as tariffs kick in,"Amazon (AMZN) is canceling some wholesale orders from Asia that it directly imports and ships to its warehouses as it begins to respond to President Donald Trump’s trade war, according to a new report.Read more...",2025-04-09T17:11:00Z,Quartz India,https://qz.com/amazon-cutting-back-tariffs-trump-trade-war-china-1851775470,2025-04-09 17:11:00+00:00,2025-04-09 13:11:00-04:00,2025-04-09 13:00:00-04:00
Amazon Seeking Finance Partner for Potential $15B Warehouse Expansion,"Tech and e-commerce giant Amazon is seeking a financing partner for a potential $15 billion plan to build warehouses in the U.S. Amazon hopes to see nearly 80 new logistics facilities built in key U.S. cities and rural areas, Bloomberg reported. Amazon offici…",2025-04-09T18:58:08Z,Commercial Observer,http://commercialobserver.com/2025/04/amazon-15b-warehouse-expansion/,2025-04-09 18:58:08+00:00,2025-04-09 14:58:08-04:00,2025-04-09 14:00:00-04:00
Where Will Amazon Stock Be In 5 Years?,"Wondering where Amazon stock may be in five years? Learn what the current state of 
AMZN stock is and what its five-year outlook may contain.",2025-04-09T19:43:00Z,Forbes,https://www.forbes.com/sites/investor-hub/article/where-will-amazon-amzn-stock-be-in-5-years/,2025-04-09 19:43:00+00:00,2025-04-09 15:43:00-04:00,2025-04-09 15:00:00-04:00
Bank of America Sees Opportunities for Amazon Amid Tariff Uncertainty,"Amazon is likely to face pressure on its profit margins as it feels the effect of the Trump administration's tariffs, but the online retail giant also has...",2025-04-09T19:06:04Z,Investopedia,https://www.investopedia.com/bank-of-america-sees-opportunities-for-amazon-amid-tariff-uncertainty-11711923,2025-04-09 19:06:04+00:00,2025-04-09 15:06:04-04:00,2025-04-09 15:00:00-04:00
"Expect Amazon prices to rise because of tariffs, CEO says | CNN Business","Amazon shoppers can likely expect some prices to rise due to the ongoing global trade war, the company’s CEO admitted.",2025-04-10T14:42:32Z,CNN,https://www.cnn.com/2025/04/10/business/amazon-ceo-prices-tariffs/index.html,2025-04-10 14:42:32+00:00,2025-04-10 10:42:32-04:00,2025-04-10 10:00:00-04:00
"Amazon needs to stay 'the world's largest startup,' CEO says","Amazon (AMZN) CEO Andy Jassy said the company needs to operate like the “world’s largest startup” on Thursday in his annual letter to shareholders — which means continuing to invest in AI, cutting bureaucracy, and expanding into different realms.Read more...",2025-04-10T14:29:00Z,Quartz India,https://qz.com/amazon-ceo-andy-jassy-shareholder-letter-ai-1851775611,2025-04-10 14:29:00+00:00,2025-04-10 10:29:00-04:00,2025-04-10 10:00:00-04:00
"Dow Jones Today: DIA ETF Down 2%, Amazon (Nasdaq: AMZN) and American Express (NYSE: AXP) Drop","Live Updates
 
 Live Coverage
 Updates appear automatically as they are published.
 
 
 
 
 
 
Good Inflation Numbers Just Came In 
 
 
 10:06 am
 by Joel South 
 
 
 
 
Inflation eased to 2.4% in March’s CPI report, beating the 2.5% prediction, while Core CP…",2025-04-10T14:28:47Z,Biztoc.com,https://biztoc.com/x/551713dff08f7e14,2025-04-10 14:28:47+00:00,2025-04-10 10:28:47-04:00,2025-04-10 10:00:00-04:00
"Cardano’s Hoskinson Sees Bitcoin Touching $250K, Tech Giants Adopting Stablecoins","“You’ll have a lot of fast, cheap money, and then it’ll pour into crypto,” he said in a recent interview.",2025-04-10T15:07:38Z,CoinDesk,https://www.coindesk.com/markets/2025/04/10/cardano-s-hoskinson-sees-bitcoin-touching-usd250k-tech-giants-adopting-stablecoins,2025-04-10 15:07:38+00:00,2025-04-10 11:07:38-04:00,2025-04-10 11:00:00-04:00
"Jim Cramer Says: “Amazon (AMZN) Has All the Cards – It’s a Steal, Frankly”","We recently published a list of Jim Cramer Calls Market Decline ‘Man-Made’ and Breaks Down 15 Stocks. In this article, we are going to take a look at where Amazon.com, Inc. (NASDAQ:AMZN) stands against other stocks that Jim Cramer discusses.
On Monday, April …",2025-04-10T16:53:14Z,Biztoc.com,https://biztoc.com/x/04b39e98c84c903f,2025-04-10 16:53:14+00:00,2025-04-10 12:53:14-04:00,2025-04-10 12:00:00-04:00
"Apple, Nvidia, Meta, and more Magnificent 7 stocks slide as the Nasdaq rally kicks into reverse","In This Article:
The roller-coaster week for global equity markets took another sharp turn Thursday, yanking Nvidia (NVDA), Apple (AAPL), Amazon (AMZN), and other Big Tech stocks down with it.
The latest shift lobbed off some of Wednesday’s historic gains; ye…",2025-04-10T16:41:50Z,Biztoc.com,https://biztoc.com/x/ece1a8f45f50fb90,2025-04-10 16:41:50+00:00,2025-04-10 12:41:50-04:00,2025-04-10 12:00:00-04:00
Microsoft stock slips. Wedbush says trade war uncertainty will hit AI plans and earnings,"Microsoft (MSFT) stock fell more than 5% in afternoon trading certainty, with Amazon (AMZN) and the other Magnificent 7 shares also losing ground as...",2025-04-10T16:29:00Z,Yahoo Entertainment,https://finance.yahoo.com/news/microsoft-stock-slips-wedbush-says-162900817.html,2025-04-10 16:29:00+00:00,2025-04-10 12:29:00-04:00,2025-04-10 12:00:00-04:00
"Apple, Nvidia, Meta, and more Magnificent 7 stocks slide","The roller-coaster week for global equity markets took another sharp turn Thursday, yanking Nvidia (NVDA), Apple (AAPL), Amazon (AMZN), and other Big Tech stocks down with it.Read more...",2025-04-10T16:01:26Z,Quartz India,https://qz.com/apple-nvidia-magnificent-7-stocks-slide-1851775625,2025-04-10 16:01:26+00:00,2025-04-10 12:01:26-04:00,2025-04-10 12:00:00-04:00
"Amazon (AMZN) Price Target Slashed by Investment Bank, But Bullish Outlook Maintained",Investment bank Piper Sandler today cut its price target on Amazon (AMZN) to $215 from $265 but kept an Overweight rating on the name. Piper expects the tech...,2025-04-10T18:39:09Z,Yahoo Entertainment,https://finance.yahoo.com/news/amazon-amzn-price-target-slashed-183909752.html,2025-04-10 18:39:09+00:00,2025-04-10 14:39:09-04:00,2025-04-10 14:00:00-04:00
Consumer confidence craters as recession fears grow,"The downturn reflects rising concerns over inflation, interest rates, geopolitical instability, and abrupt policy changes",2025-04-11T15:59:00Z,Quartz India,https://qz.com/consumer-sentiment-declines-april-2025-1851775805,2025-04-11 15:59:00+00:00,2025-04-11 11:59:00-04:00,2025-04-11 11:00:00-04:00
"Nancy Pelosi's 2025 Stock Buys Worth $1.95M are Deep in Red, Some as Much as 57%","Former House Speaker Nancy Pelosi purchased call option contracts of companies, including Alphabet, Amazon, Nvidia, Vistra Corp, and Tempus AI, in January.",2025-04-11T18:13:23Z,International Business Times,https://www.ibtimes.com/nancy-pelosis-2025-stock-buys-worth-195m-are-deep-red-some-much-57-3769775,2025-04-11 18:13:23+00:00,2025-04-11 14:13:23-04:00,2025-04-11 14:00:00-04:00
Amazon (NASDAQ: AMZN) Stock Price Prediction for 2025: Where Will It Be in 1 Year,"For shareholders of Amazon.com Inc. (NASDAQ:AMZN), a difficult month continues. The stock has lost -8.79%, bringing its year-to-date loss to more than -18%. After shares of Amazon gained nearly 80% in 2024, its one-year performance has resulted in a -1.64% lo…",2025-04-14T16:51:35Z,Biztoc.com,https://biztoc.com/x/3b59f6205eee0453,2025-04-14 16:51:35+00:00,2025-04-14 12:51:35-04:00,2025-04-14 12:00:00-04:00
Corporate A.I. Ethics Is Now a Boardroom Issue: The Business Case for Doing A.I. Right,"In 2025, Corporate A.I. Responsibility (CAIR) defines the new ethical frontier, forcing businesses to grapple with questions of fairness, transparency, economic disruption and environmental impact. This framework isn’t just a compliance checklist—it’s a litmu…",2025-04-14T17:25:08Z,Observer,https://observer.com/2025/04/corporate-ai-responsibility-in-2025-how-to-navigate-ai-ethics/,2025-04-14 17:25:08+00:00,2025-04-14 13:25:08-04:00,2025-04-14 13:00:00-04:00
"Bullish Notes Issued on Amazon (AMZN), JPMorgan (JPM)","Investment banks JMP Securities and CFRA today issued bullish notes on Amazon (AMZN) and JPMorgan (JPM), respectively. However, both banks cut their price...",2025-04-14T18:27:41Z,Yahoo Entertainment,https://finance.yahoo.com/news/bullish-notes-issued-amazon-amzn-182741554.html,2025-04-14 18:27:41+00:00,2025-04-14 14:27:41-04:00,2025-04-14 14:00:00-04:00
